{
  "zarr_format": 3,
  "node_type": "array",
  "shape": [1200, 180, 288],
  "dimension_names": ["time", "lat", "lon"],
  "attributes": {
    "zarr_conventions": [
      {
        "schema_url": "https://raw.githubusercontent.com/R-CF/zarr_convention_cs/main/schema.json",
        "name": "cs"
      },
      {
        "schema_url": "https://raw.githubusercontent.com/R-CF/zarr_convention_ref/main/schema.json",
        "name": "ref"
      }
    ],
    "cs": {
      "crs": [
        {
          "name": "WGS84",
          "axes": {
            "lon": {
              "abbreviation": "X",
              "coordinates": [
                {
                  "direction": "east",
                  "unit": "degrees",
                  "values": {
                    "regular": [0.625, 1.25]
                  },
                  "boundaries": {
                    "regular": [-0.625, 0.625]
                  }
                }
              ]
            },
            "lat": {
              "abbreviation": "Y",
              "coordinates": [
                {
                  "direction": "north",
                  "unit": "degrees",
                  "values": {
                    "regular": [-89.5, 1]
                  },
                  "boundaries": {
                    "regular": [-0.5, 0.5]
                  }
                }
              ]
            }
          }
        },
        {
          "name": "Temporal scale based on the 'noleap' model calendar.",
          "axes": {
            "time": {
              "abbreviation": "T",
              "coordinates": [
                {
                  "direction": "future",
                  "time": {
                    "unit": "day",
                    "epoch": "1850-01-01",
                    "calendar": "noleap"
                  },
                  "values": {
                    "external": {
                      "ref": {
                        "node": "../time"
                      }
                    }
                  },
                  "boundaries": {
                    "external": {
                      "ref": {
                        "node": "../time_bnds"
                      }
                    }
                  }
                }
              ]
            }
          }
        }
      ]
    }
  }
}
