{
  "zarr_format": 3,
  "node_type": "array",
  "shape": [1800, 412, 424],
  "dimension_names": ["time", "rlat", "rlon"],
  "attributes": {
    "zarr_conventions": [
      {
        "schema_url": "https://raw.githubusercontent.com/R-CF/zarr_convention_cs/main/schema.json",
        "name": "cs"
      },
      {
        "schema_url": "https://raw.githubusercontent.com/R-CF/zarr_convention_geolocation/main/schema.json",
        "name": "geolocation"
      },
      {
        "schema_url": "https://raw.githubusercontent.com/zarr-conventions/geo-proj/main/schema.json",
        "name": "proj"
      }
    ],
    "cs": {
      "crs": [
        {
          "name": "rotated pole grid for CORDEX EUR-11 domain",
          "axes": [
            {
              "name": "rlon",
              "abbreviation": "X",
              "coordinates": [
                {
                  "direction": "east",
                  "unit": "degrees",
                  "values": {
                    "regular": [-28.375, 0.11]
                  }
                }
              ]
            },
            {
              "name": "rlat",
              "abbreviation": "Y",
              "coordinates": [
                {
                  "direction": "north",
                  "unit": "degrees",
                  "values": {
                    "regular": [-23.375, 0.11]
                  }
                }
              ]
            }
          ],
          "geolocation": {
            "geodetic": {
              "x": {
                "node": "lon"
              },
              "y": {
                "node": "lat"
              },
              "crs": {
                "proj:code": "EPSG:4326"
              }
            }
          }
        },
        {
          "name": "Temporal scale based on the '360_day' model calendar.",
          "axes": [
            {
              "name": "time",
              "abbreviation": "T",
              "coordinates": [
                {
                  "direction": "future",
                  "time": {
                    "unit": "day",
                    "epoch": "1949-12-01",
                    "calendar": "360_day"
                  },
                  "values": {
                    "regular": [20190.5, 1]
                  },
                  "boundaries": {
                    "regular": [-0.5, 0.5]
                  }
                }
              ]
            }
          ]
        }
      ]
    }
  }
}
