{
  "zarr_format": 3,
  "node_type": "array",
  "shape": [1, 23],
  "dimension_names": ["time", "geo_region"],
  "attributes": {
    "zarr_conventions": [
      {
        "schema_url": "https://raw.githubusercontent.com/R-CF/zarr_convention_cs/main/schema.json",
        "name": "cs"
      }
    ],
    "cs": {
      "crs": [
        {
          "axes": [
            {
              "name": "geo_region",
              "coordinates": [
                {
                  "values": {
                    "explicit": ["Anglian", "Argyll", "Clyde", "Dee", "Forth", "Humber", "Neagh Bann", "North East Scotland", "North Eastern Ireland", "North Highland", "North West England", "North Western Ireland", "Northumbria", "Orkney and Shetland", "Severn", "Solway", "South East England", "South West England", "Tay", "Thames", "Tweed", "West Highland", "Western Wales"]
                  }
                }
              ]
            }
          ]
        },
        {
          "axes": [
            {
              "name": "time",
              "abbreviation": "T",
              "coordinates": [
                {
                  "direction": "future",
                  "time": {
                    "reference": "hours since 1800-01-01",
                    "calendar": "standard"
                  },
                  "values": {
                    "explicit": [1678608]
                  },
                  "boundaries": {
                    "regular": [-4344, 258624]
                  }
                }
              ]
            }
          ]
        }
      ]
    }
  }
}
