{
  "zarr_format": 3,
  "node_type": "array",
  "shape": [1464, 360, 720],
  "dimension_names": ["time", "lat", "lon"],
  "attributes": {
    "zarr_conventions": [
      {
        "schema_url": "https://raw.githubusercontent.com/R-CF/zarr_convention_cs/main/schema.json",
        "name": "cs"
      },
      {
        "schema_url": "https://raw.githubusercontent.com/R-CF/zarr_convention_ref/main/schema.json",
        "name": "ref"
      }
    ],
    "cs": {
      "crs": [
        {
          "node": "..",
          "attribute": "/attributes/crs/WGS84"
        },
        {
          "node": "..",
          "attribute": "/attributes/crs/standard_calendar"
        }
      ]
    }
  }
}
